{
    "$schema": "./config.schema.json",
    "schema_version": 2,
    "huggingface": {
        "downloads": [
            {
                "engine": "xet",
                "settings": {
                    "high_performance": true,
                    "concurrent_range_gets": 64
                }
            },
            {
                "engine": "hf_hub"
            }
        ]
    },
    "models": [
        {
            "source": "huggingface",
            "repo": "Comfy-Org/MiniMax-H3",
            "files": [
                "diffusion_models/minimax_h3_fl2va_pruned_int8_convrot.safetensors",
                "text_encoders/qwen3vl_32b_minimax_h3_nvfp4_awq.safetensors",
                "vae/minimax_h3_video_vae_fp16.safetensors",
                "vae/minimax_h3_audio_vae_fp32.safetensors"
            ],
            "engine": "xet"
        },
        {
            "source": "huggingface",
            "repo": "alibaba-pai/MiniMax-H3-Acc-LoRAs",
            "files": [
                "MiniMax-H3-FL2VA-Acc-8Step.safetensors",
                "MiniMax-H3-Ref2VA-Acc-8Step.safetensors"
            ],
            "engine": "xet"
        }
    ],
    "modules": [
        {
            "url": "https://github.com/StanLukuvka/ComfyUI-MiniMax-H3-SPEED",
            "branch": "${SPEED_BRANCH:-main}"
        },
        {
            "url": "https://github.com/Jalen-Brunson/ComfyUI-MiniMax-H3-PDD-Acc"
        },
        {
            "url": "https://github.com/xmarre/ComfyUI-Spectrum-MiniMax-H3"
        }
    ],
    "env": {
        "HF_HUB_ENABLE_HF_TRANSFER": "0"
    }
}
